{
  "architecture": {
    "boundaries": [],
    "components": [
      "popup",
      "scripts"
    ],
    "constraints": [],
    "summary": ""
  },
  "commands": {
    "build": [],
    "install": [],
    "lint": [],
    "test": [],
    "typecheck": []
  },
  "conventions": {
    "coding": [
      "Follow project AGENTS.md instructions."
    ],
    "git": [
      "Preserve repository history and use task branches/PR delivery."
    ],
    "testing": []
  },
  "decisions": [],
  "discovery": {
    "files_observed": 12,
    "fingerprint": "069e3b415b6ed16ca5317d542eeb0aa56a998d7a7019065119145553ad646a8e",
    "generated_at": "2026-08-23T11:16:55.142636+00:00",
    "inventory_fingerprint": "f562ca47be85ebe0e8f78cce87e7f62450dbb72d0f4cdfa28715268c58447ee9",
    "scan_limit": 10000,
    "source_file_count": 4,
    "sources": [
      {
        "mtime_ns": 1787483413517449500,
        "path": "AGENTS.md",
        "sha256": "ee7744656e8e3eda3c1531553514b5125bb8a91e25c0bb801f530e40c3827b12",
        "size": 3773
      },
      {
        "mtime_ns": 1787483662359895100,
        "path": "popup/jszip.min.js",
        "sha256": "acc7e41455a80765b5fd9c7ee1b8078a6d160bbbca455aeae854de65c947d59e",
        "size": 97630
      },
      {
        "mtime_ns": 1787483755938954700,
        "path": "popup/popup.js",
        "sha256": "7318aa1633c17b3ebe4669f8f80471a9952ba45d925921e82b961e6252211a1c",
        "size": 48926
      },
      {
        "mtime_ns": 1787480368888003300,
        "path": "scripts/extractor.js",
        "sha256": "fb928453526f9fb746b7398b3eba22a049d91daad87ad6fb38466369f7deb967",
        "size": 10698
      },
      {
        "mtime_ns": 1787483765793781400,
        "path": "test_extension.js",
        "sha256": "e7ec38149048f92fb8d96d07476e37430491f1502fa8354c7303d1f24483e06d",
        "size": 6601
      }
    ]
  },
  "environment": {
    "required_variable_names": []
  },
  "known_risks": [],
  "modules": [
    {
      "language_hints": [
        "JavaScript"
      ],
      "path": "popup",
      "source_file_count": 2
    },
    {
      "language_hints": [
        "JavaScript"
      ],
      "path": ".",
      "source_file_count": 1
    },
    {
      "language_hints": [
        "JavaScript"
      ],
      "path": "scripts",
      "source_file_count": 1
    }
  ],
  "project": {
    "name": "download-images",
    "repository": "BinLate/download-images",
    "root": "C:\\Users\\Bin.Late\\Documents\\Vibe-Code\\Extension\\download-images"
  },
  "provenance": {
    "commands": {
      "build": [],
      "install": [],
      "lint": [],
      "test": [],
      "typecheck": []
    },
    "conventions": [
      "AGENTS.md"
    ],
    "environment": [],
    "modules": [
      "popup/jszip.min.js",
      "popup/popup.js",
      "scripts/extractor.js",
      "test_extension.js"
    ],
    "redactions": [],
    "stack": [
      "AGENTS.md"
    ]
  },
  "schema_version": "2.1.0",
  "stack": {
    "frameworks": [],
    "languages": [
      {
        "file_count": 4,
        "name": "JavaScript"
      }
    ],
    "package_managers": []
  },
  "updated_at": "2026-08-23T11:16:55.142741+00:00"
}
